{
  "$schema": "https://json-schema.org/draft/2020-12/schema",
  "$id": "https://nebula.invalid/schemas/deployment-manifest.schema.json",
  "title": "Nebula Arbitrum Sepolia Deployment Manifest",
  "description": "Public facts recorded only after deployment receipt, getter, bytecode, and explorer verification.",
  "type": "object",
  "additionalProperties": false,
  "required": [
    "network",
    "chain_id",
    "contract_address",
    "usdc_address",
    "owner_address",
    "verifier_address",
    "deployment_transaction_hash",
    "deployment_block",
    "deployed_at_utc",
    "source_commit",
    "abi_sha256",
    "runtime_template_sha256",
    "on_chain_code_sha256",
    "compiler",
    "optimizer_enabled",
    "optimizer_runs",
    "via_ir",
    "evm_version",
    "explorer_url",
    "source_verified"
  ],
  "properties": {
    "network": { "const": "arbitrum-sepolia" },
    "chain_id": { "const": 421614 },
    "contract_address": { "$ref": "#/$defs/address" },
    "usdc_address": { "const": "0x75faf114eafb1BDbe2F0316DF893fd58CE46AA4d" },
    "owner_address": { "$ref": "#/$defs/address" },
    "verifier_address": { "$ref": "#/$defs/address" },
    "deployment_transaction_hash": { "$ref": "#/$defs/transactionHash" },
    "deployment_block": { "type": "integer", "minimum": 1 },
    "deployed_at_utc": { "type": "string", "format": "date-time", "pattern": "^\\d{4}-\\d{2}-\\d{2}T\\d{2}:\\d{2}:\\d{2}(?:\\.\\d{1,6})?Z$" },
    "source_commit": { "type": "string", "pattern": "^(?!0{40}$)[0-9a-f]{40}$" },
    "abi_sha256": { "$ref": "#/$defs/sha256" },
    "runtime_template_sha256": { "$ref": "#/$defs/sha256", "description": "Hash of the unlinked artifact runtime template." },
    "on_chain_code_sha256": { "$ref": "#/$defs/sha256", "description": "Hash of deployed runtime code; differs from the template because USDC is immutable." },
    "compiler": { "const": "0.8.20+commit.a1b79de6" },
    "optimizer_enabled": { "const": true },
    "optimizer_runs": { "const": 200 },
    "via_ir": { "const": true },
    "evm_version": { "const": "shanghai" },
    "explorer_url": { "type": "string", "format": "uri" },
    "source_verified": { "const": true }
  },
  "$defs": {
    "address": { "type": "string", "pattern": "^0x(?!0{40}$)[0-9a-fA-F]{40}$" },
    "transactionHash": { "type": "string", "pattern": "^0x(?!0{64}$)[0-9a-fA-F]{64}$" },
    "sha256": { "type": "string", "pattern": "^(?!0{64}$)[0-9a-f]{64}$" }
  }
}
